{"run":19,"commit":"d32e061","metric":908.96,"metrics":{"large_subset_ms":205.12,"large_whole_ms":222.41,"pk_ms":46.77,"subset_ms":91.12,"filtered_ms":256.27,"whole_ms":87.27},"status":"discard","description":"Re-measure the seek path and confirm the filtered-browse regression is real","timestamp":1788776064730,"segment":2,"confidence":8.795890837397542,"asi":{"hypothesis":"Re-running unchanged code separates the filtered_ms rise from run-to-run noise and confirms the seek win holds after the index rebuild.","rollback_reason":"908.96 vs the 901.73 best is a re-measurement of identical code, not an improvement; no production changes existed to revert.","confirmed":"The seek win is stable (large_subset 205-210 ms, large_whole 222-227 ms). filtered_ms is reproducibly 246-256 ms against 219 ms before the index, so the +14% is real and not noise.","search_benchmarks_unaffected":"query group A/B across fb7ca05 and d32e061: sum of subject modes 330.62 vs 330.47 ms with individual subjects scattered -10% to +7%, so the new index does not disturb search query plans.","next_action_hint":"Explain the filtered browse query plan with and without documents_id; the filtered workload still runs through Searcher with a plain OFFSET so the planner may now prefer the new index over the table scan."}}
{"run":20,"commit":"d32e061","metric":925.83,"metrics":{"large_subset_ms":213.38,"large_whole_ms":224.51,"pk_ms":47.43,"subset_ms":92.34,"filtered_ms":260.77,"whole_ms":87.4},"status":"discard","description":"Partial documents(_id) index measured against a stale benchmark fixture","timestamp":1788776458991,"segment":2,"confidence":5.172443251159382,"asi":{"hypothesis":"Making documents_id partial on the always-true predicate _id > 0 stops the planner picking it for scans that read _document, which should recover the filtered-browse regression.","rollback_reason":"The measurement is invalid, not the change. makeDocumentsIdIndexPartial() only runs inside updateSchema(), which fires on document-schema changes, so the existing benchmark databases still carried CREATE INDEX documents_id ON documents (_id) with no predicate. The 51 s benchmark runtime confirms nothing was rebuilt.","evidence_the_change_is_right":"On a rebuilt database the Searcher outer query plans as SCAN d instead of SCAN d USING INDEX documents_id, and the boundary lookup with INDEXED BY plus the matching predicate traverses the 20000-document corpus in 2.99 ms against 261.31 ms without it.","dbal_note":"DBAL cannot express partial indexes on SQLite (only PostgreSQL implements supportsPartialIndexes). It introspects a partial index as a plain one and produces zero diff SQL, so declaring it plain in the schema and creating it partial in raw SQL is stable across schema comparisons.","patch_saved":"/tmp/partial-index.patch","next_action_hint":"Delete var/bench indexes so both corpora rebuild with the partial index, re-apply the patch and measure again."}}
