{"type":"config","name":"Faster Browse API ID iteration","metricName":"browse_all_ids_ms","metricUnit":"ms","bestDirection":"lower"}
{"run":1,"commit":"54ddae9","metric":150.476166,"metrics":{"min_ms":143.415000,"max_ms":151.897458,"spread_ms":8.482458,"docs":31944,"pages":32,"peak_memory_mb":136.394531},"status":"keep","description":"Baseline full-corpus Browse ID traversal","timestamp":1788719495000,"segment":0,"confidence":null,"asi":{"hypothesis":"Establish the unmodified Browse API baseline after installing the required loupe/matcher 0.4 dependency.","workload":"31944 documents, 32 pages, only user-facing id retrieved","environment_note":"Initial checks failed because vendor had stale matcher 0.3.2 while composer.json requires ^0.4; composer update to 0.4.0 fixed unit tests and PHPStan without tracked changes.","next_action_hint":"Avoid decoding _document when only the configured primary key is requested; select _user_id directly while retaining internal _id ordering."}}
{"run":2,"commit":"67e3b8c","metric":87.830708,"metrics":{"min_ms":84.668125,"max_ms":100.555750,"spread_ms":15.887625,"docs":31944,"pages":32,"peak_memory_mb":6.000000},"status":"keep","description":"Avoid full document decoding for Browse ID projection","timestamp":1788719630000,"segment":0,"confidence":null,"asi":{"hypothesis":"SQLite json_extract can preserve the original scalar ID type while avoiding full _document transfer and PHP JSON decoding for primary-key-only Browse projections.","learning":"Direct _user_id selection would lose the distinction between integer IDs and numeric string IDs; JSON extraction preserves that API behavior.","impact":"Median traversal improved 41.6% and peak memory fell from 136.4 MB to 6 MB.","checks":"Unit tests, PHPStan, and Functional BrowseTest passed.","next_action_hint":"Profile the remaining 88 ms; compare json_extract against SQLite arrow syntax and investigate repeated total-hit counting or broader narrow projections."}}
{"run":3,"commit":"0c95981","metric":66.533500,"metrics":{"min_ms":64.686208,"max_ms":67.312459,"spread_ms":2.626251,"docs":31944,"pages":32,"peak_memory_mb":4.000000},"status":"keep","description":"Skip matches join for unconstrained Browse queries","timestamp":1788719742000,"segment":0,"confidence":3.941560,"asi":{"hypothesis":"An empty-query, empty-filter Browse already matches the documents table, so building an all-documents CTE and joining it back to the same table is redundant.","learning":"Direct table scan with scalar document count preserves internal _id ordering and total-hit metadata while removing a self-join from every page.","impact":"Median improved 24.2% from the previous best and 55.8% from baseline; spread narrowed to 2.63 ms.","checks":"Unit tests, PHPStan, and Functional BrowseTest passed.","next_action_hint":"Measure whether scalar COUNT(*) is now repeated materially across 32 pages; test a general narrow projection or reduce OFFSET traversal cost without changing pagination semantics."}}
{"run":4,"commit":"0c95981","metric":67.985583,"metrics":{"min_ms":63.490000,"max_ms":69.000000,"spread_ms":5.510000,"docs":31944,"pages":32,"peak_memory_mb":4.000000},"status":"discard","description":"Compare SQLite ->> operator for primary-key extraction","timestamp":1788719793000,"segment":0,"confidence":7.882974,"asi":{"hypothesis":"SQLite's ->> JSON scalar operator might be cheaper than json_extract for the primary-key projection.","rollback_reason":"Median was 2.2% slower than the 66.533500 ms best and had a wider spread; syntax-only change offered no simplification benefit.","learning":"Keep json_extract for this projection on the benchmark SQLite/PHP environment.","next_action_hint":"Target work repeated per page, especially OFFSET and result/count SQL, rather than alternate JSON syntax."}}
{"run":5,"commit":"28e1a71","metric":37.354167,"metrics":{"min_ms":36.379166,"max_ms":39.453875,"spread_ms":3.074709,"docs":31944,"pages":32,"peak_memory_mb":4.000000},"status":"keep","description":"Read projected Browse IDs from indexed user ID","timestamp":1788720051000,"segment":0,"confidence":5.700241192736254,"asi":{"hypothesis":"The persisted document schema can restore the public primary-key scalar type from indexed _user_id, eliminating per-hit JSON parsing entirely.","learning":"TYPE_STRING can use _user_id verbatim; TYPE_NUMBER with SQLite CAST AS NUMERIC preserves integer versus real values. Other unexpected schema types retain the json_extract fallback.","impact":"Median improved 43.9% from the previous best and 75.2% from baseline while memory stayed at 4 MB.","checks":"Unit tests, PHPStan, Functional BrowseTest, and a focused integer/float/numeric-string/leading-zero-string harness passed.","next_action_hint":"Profile the remaining 37 ms. Test whether selecting only internal IDs then joining for the limited page reduces OFFSET work, or reduce per-page object/query construction."}}
{"run":6,"commit":"1cec044","metric":34.620708,"metrics":{"min_ms":33.132334,"max_ms":38.429917,"spread_ms":5.297583,"docs":31944,"pages":32,"peak_memory_mb":4.000000},"status":"keep","description":"Seek unconstrained Browse pages by internal ID","timestamp":1788720180000,"segment":0,"confidence":4.590467,"asi":{"hypothesis":"A scalar subquery can resolve the internal-ID boundary for an offset, letting the outer ordered scan seek directly to the returned page instead of carrying OFFSET through projection.","learning":"Keeping resultOffset separate preserves public page metadata after resetting the SQL offset. A deleted-ID gap harness confirmed row-offset rather than numeric-ID semantics.","impact":"Median improved 7.3% from the previous best and 77.0% from baseline.","checks":"Unit tests, PHPStan, Functional BrowseTest, and deleted-ID offset/page harness passed.","next_action_hint":"The gain is smaller and run spread is wider; confirm once, then inspect per-page PHP construction or scalar count overhead."}}
{"run":7,"commit":"1cec044","metric":35.479250,"metrics":{"min_ms":34.949000,"max_ms":38.609792,"spread_ms":3.660792,"docs":31944,"pages":32,"peak_memory_mb":4.000000},"status":"discard","description":"Confirm internal-ID offset seek measurement","timestamp":1788720180001,"segment":0,"confidence":3.970463,"asi":{"hypothesis":"A second run should remain materially below the 37.354167 ms prior best if the seek improvement is real.","rollback_reason":"The confirmation was slower than experiment 6, so it does not replace the recorded best; no uncommitted production changes existed to revert.","learning":"The confirmed median remains 5.0% below the pre-seek best, supporting the committed change despite ordinary run-to-run noise.","next_action_hint":"Optimize a structurally different repeated cost rather than micro-tuning the seek SQL."}}
{"run":8,"commit":"e490f8f","metric":32.001583,"metrics":{"min_ms":31.562500,"max_ms":35.723625,"spread_ms":4.161125,"docs":31944,"pages":32,"peak_memory_mb":4.000000},"status":"keep","description":"Count unconstrained Browse hits outside result rows","timestamp":1788720276000,"segment":0,"confidence":7.0128805122596525,"asi":{"hypothesis":"Fetching totalHits independently avoids materializing and transferring the same scalar count in every one of 31944 result rows.","learning":"One cheap count query per request costs less than an extra totalHits column on every hit. The independent count also remains available when an offset returns no rows.","impact":"Median improved 7.6% from the best committed seek run and 78.7% from baseline.","checks":"Unit tests, PHPStan, and Functional BrowseTest passed.","next_action_hint":"Try bypassing unused empty-query Searcher pipeline setup, but reject a large duplicated fast path unless the gain is material."}}
{"run":9,"commit":"c18f53c","metric":22.650583,"metrics":{"min_ms":21.637334,"max_ms":23.382291,"spread_ms":1.744957,"docs":31944,"pages":32,"peak_memory_mb":4.000000},"status":"keep","description":"Add direct path for browsing primary keys","timestamp":1788720434000,"segment":0,"confidence":8.693498333467543,"asi":{"hypothesis":"The dominant remaining overhead is constructing and running the general Searcher pipeline 32 times for a workload requiring only ordered primary keys.","learning":"A narrow Engine fast path can reuse all established SQL semantics while avoiding parser, filter builder, sorting, token, CTE, and result hydration setup. Query/filter or broader projections still fall back to Searcher.","impact":"Median improved 29.2% from the prior best and 84.9% from baseline; spread narrowed to 1.74 ms.","checks":"Unit tests, PHPStan, BrowseTest, custom-primary-key and queried-fallback cases, typed IDs, and deleted-ID pagination passed.","next_action_hint":"Profile the 22.7 ms floor. Avoid duplicating more logic for tiny gains; consider query-builder/result iteration overhead or document-count caching only if concurrency semantics stay correct."}}
{"run":10,"commit":"c18f53c","metric":24.061541,"metrics":{"min_ms":23.362041,"max_ms":26.278417,"spread_ms":2.916376,"docs":31944,"pages":32,"peak_memory_mb":4.000000},"status":"discard","description":"Stream direct primary-key SQL without QueryBuilder","timestamp":1788720493000,"segment":0,"confidence":9.787079299634977,"asi":{"hypothesis":"Avoiding QueryBuilder construction and streaming Result::iterateColumn might reduce per-page setup and temporary arrays.","rollback_reason":"Median regressed 6.2% from 22.650583 ms and spread widened; fetchFirstColumn materialization is faster for 1000-value pages.","learning":"DBAL QueryBuilder overhead is smaller than generator iteration overhead in this workload. Keep the materialized fetchFirstColumn path.","next_action_hint":"Do not pursue streaming for small bounded pages. Investigate count-query cost or stop before added complexity outweighs gains."}}
{"run":11,"commit":"3e8ff00","metric":19.785500,"metrics":{"min_ms":19.354000,"max_ms":20.371291,"spread_ms":1.017291,"docs":31944,"pages":32,"peak_memory_mb":4.000000},"status":"keep","description":"Confirm direct primary-key Browse performance","timestamp":1788720579000,"segment":0,"confidence":10.187392501496845,"asi":{"hypothesis":"Rerunning the unchanged best implementation should confirm that the dedicated Engine path remains decisively faster after the discarded streaming experiment.","learning":"The direct path repeated below its initial measurement with lower spread; QueryBuilder fetchFirstColumn remains the correct local optimum.","impact":"Confirmed median is 86.9% below baseline with peak memory reduced from 136.4 MB to 4 MB.","checks":"Unit tests and PHPStan passed on unchanged production code.","next_action_hint":"Current implementation is near the measured direct-DBAL floor. Shift to a structurally different idea only; avoid micro-optimizations within normal noise."}}
{"run":12,"commit":"1c39bd8","metric":20.361084,"metrics":{"min_ms":19.645625,"max_ms":23.358791,"spread_ms":3.713166,"docs":31944,"pages":32,"peak_memory_mb":4.000000},"status":"keep","description":"Keep Browse page counts snapshot-consistent","timestamp":1788720699000,"segment":0,"confidence":9.64923671264459,"asi":{"hypothesis":"A read transaction can preserve the old single-statement snapshot semantics after splitting totalHits from page rows, with negligible cost.","learning":"The transaction adds about 0.6 ms versus the unusually fast prior rerun and remains faster than the direct path's initial measurement. Fast-path placement inside the reindex catch and fallback for invalid pagination are required correctness guards.","impact":"Correctness-hardened implementation remains 86.5% faster than baseline and uses 4 MB peak memory.","checks":"Unit tests, PHPStan, BrowseTest, and negative-offset legacy behavior passed.","next_action_hint":"Current path is at the direct DBAL floor. Prefer reviewing robustness and reducing duplication over speculative micro-optimization."}}
{"type":"config","name":"Browse API projection via SQLite json_extract","metricName":"browse_total_ms","metricUnit":"ms","bestDirection":"lower"}
{"run":13,"commit":"009ca1f","metric":610.34,"metrics":{"pk_ms":135.82,"subset_ms":138.03,"whole_ms":123.92,"filtered_ms":212.57},"status":"keep","description":"Baseline: browse projections always select and JSON-decode the full _document","timestamp":1788770066261,"segment":1,"confidence":null,"asi":{"hypothesis":"Establish a baseline for four browse projection workloads on the 31944-document movies corpus.","workload":"32 pages x 1000 docs, four projections: primary key only, 3-attribute subset, whole document, filtered subset","current_implementation":"Searcher::selectDocuments() always adds documents._document; fetchResult() calls Util::decodeJson() per hit then array_intersect_key().","environment_note":"phpunit needed memory_limit=1G in .auto/checks.sh; the 128M default OOMs in vendor/toflar/fast-set unrelated to this work.","next_action_hint":"Project only requested attributes with SQLite json_extract instead of transferring/decoding the whole document; add a direct path when only the primary key is asked for."}}
{"type":"config","name":"Browse API projection via SQLite json_extract (6 workloads incl. large documents)","metricName":"browse_total_ms","metricUnit":"ms","bestDirection":"lower"}
{"run":14,"commit":"e00516f","metric":1749.39,"metrics":{"large_subset_ms":565.06,"large_whole_ms":564.24,"pk_ms":137.89,"subset_ms":132.5,"filtered_ms":215.06,"whole_ms":134.64},"status":"keep","description":"Baseline on six browse workloads including a 4 KB-document corpus","timestamp":1788770688272,"segment":2,"confidence":null,"asi":{"hypothesis":"The 510-byte movies corpus hides the value of a narrow projection; add a 20000-document/4 KB-body corpus so the benchmark reflects page/article indexing before changing src.","probe_size_scaling":"Standalone PDO probe: json_extract multipath vs full-document decode is -2% at 500 B docs, -37% at 2 KB, -73% at 10 KB. Primary-key-only via _user_id is -75% to -96% at every size.","probe_sql_variants":"On the movies DB (510 B docs, 32 pages): full decode 124.2 ms, json_extract multipath 101.5 ms, json_object+json_extract 119.4 ms, per-attribute -> columns 124.6 ms, json_group_object over json_each 139.3 ms, _user_id only 51.9 ms.","open_semantics_questions":"Multipath json_extract returns values in requested (sorted) order rather than document order, and cannot distinguish an absent key from a JSON null. Both are observable through assertSame in the functional tests.","next_action_hint":"Implement Searcher projection via json_extract plus an Engine primary-key-only path, then measure which functional tests fail on key order."}}
{"run":15,"commit":"736e43e","metric":1687.17,"metrics":{"large_subset_ms":568.86,"large_whole_ms":581.9,"pk_ms":45.68,"subset_ms":126.9,"filtered_ms":224.77,"whole_ms":139.06},"status":"keep","description":"Answer primary-key-only browsing straight from the documents table with json_extract","timestamp":1788771307688,"segment":2,"confidence":null,"asi":{"hypothesis":"An unfiltered, unqueried browse that asks only for the primary key needs neither the document body nor the Searcher pipeline; json_extract on the stored document returns the id with its original scalar type.","impact":"pk_ms 137.89 -> 45.68 ms (-67%); total 1749.39 -> 1687.17 ms. Other five workloads unchanged within noise.","why_json_extract_over_user_id":"_user_id is a TEXT column, so an integer id would come back as a string. json_extract preserves the stored JSON type exactly, which a differential harness confirmed for integer, float, leading-zero-string and digit-only-string primary keys.","checks":"Unit + functional suites, PHPStan, plus a differential harness comparing the fast path to the Searcher path over offset/limit/page pagination, deleted-id gaps, and filter fallback.","pre_existing_finding":"A float primary key of 3.0 already comes back as int 3 on both paths because Util::encodeJson drops the zero fraction. Not a regression.","next_action_hint":"The generic subset projection is still open: plain multipath json_extract breaks 62 tests because it reorders hit keys and cannot tell an absent attribute from a null one."}}
{"run":16,"commit":"736e43e","metric":1716.03,"metrics":{"large_subset_ms":528.29,"large_whole_ms":579.78,"pk_ms":48.96,"subset_ms":179.89,"filtered_ms":239.14,"whole_ms":139.97},"status":"discard","description":"Project subsets with json_group_object over json_each (exact but slower overall)","timestamp":1788771493207,"segment":2,"confidence":2.155925155925164,"asi":{"hypothesis":"json_group_object over json_each with a CASE that restores JSON types is the only single-parse projection that keeps document key order and tells an absent attribute from a null one, so it should be adoptable without touching a single test.","correctness_result":"All 378 unit + functional tests passed unchanged, confirming the formulation is byte-identical to decoding the whole document.","rollback_reason":"Total regressed 1687.17 -> 1716.03 ms. It won on 4 KB documents (large_subset 568.86 -> 528.29) but lost badly on the 510-byte movies corpus (subset 126.90 -> 179.89, +42%) because json_each pays virtual-table overhead per document key regardless of document size.","key_finding":"large_subset is 568 ms while a raw PDO loop over the same 20 pages of 4 KB documents takes only ~138 ms, so roughly 75% of browse time is Searcher pipeline construction, not document decoding. Projection can only ever address the remaining quarter.","next_action_hint":"Generalise the direct browse path from primary-key-only to any unqueried, unfiltered browse so the whole Searcher pipeline is skipped; do the projection there where no CTE overhead masks it."}}
{"run":17,"commit":"fb7ca05","metric":1585.51,"metrics":{"large_subset_ms":573.98,"large_whole_ms":575.82,"pk_ms":45.38,"subset_ms":86.99,"filtered_ms":219.33,"whole_ms":84.01},"status":"keep","description":"Answer every unqueried, unfiltered browse straight from the documents table","timestamp":1788771691583,"segment":2,"confidence":5.267759562841512,"asi":{"hypothesis":"A browse without a query and without a filter matches every document, so the CTE pipeline, filter builder, tokenizer and sorting setup are pure overhead; the documents table alone answers it in the same internal id order.","impact":"Total 1687.17 -> 1585.51 ms. subset 126.90 -> 86.99 (-31%), whole 139.06 -> 84.01 (-40%).","surprise":"The 4 KB-document workloads did not move at all (large_subset 568.86 -> 573.98, large_whole 581.90 -> 575.82), so the previous run's inference that 75% of browse time is pipeline construction only holds for small documents. On large documents the cost is document transfer and decoding.","checks":"Unit + functional suites, PHPStan, plus a 73-comparison differential harness that runs every projection through both the direct path and the Searcher path (forced with an always-true filter) and compares toArray() and json_encode of the hits, covering nested objects, booleans, floats, explicit nulls, absent attributes and unknown attributes.","next_action_hint":"Profile the 574 ms of large_subset: a raw PDO loop over the same pages costs ~138 ms, so find whether the gap is DBAL row fetching, JSON decoding or SQLite reads before trying a projection again."}}
{"run":18,"commit":"d32e061","metric":901.73,"metrics":{"large_subset_ms":209.82,"large_whole_ms":226.99,"pk_ms":45.54,"subset_ms":89.75,"filtered_ms":246.04,"whole_ms":83.59},"status":"keep","description":"Seek browse pages through a covering documents(_id) index instead of OFFSET","timestamp":1788775781341,"segment":2,"confidence":13.623593699774988,"asi":{"hypothesis":"_id is the rowid, so OFFSET walks the table b-tree and reads a page per skipped document. An index holding only the ids lets SQLite resolve the offset boundary from index pages and the outer scan then starts at the requested page.","impact":"Total 1585.51 -> 901.73 ms (-43%), and -48.5% from the session baseline. large_subset 573.98 -> 209.82 (-63%), large_whole 575.82 -> 226.99 (-61%).","write_cost_measured":"Index benchmark group, median of 3 full runs: 68973.08 ms without the index vs 68064.81 ms with it. No subject regressed beyond noise; indexing is dominated by tokenization. Database size +0.12% (+320 KB on the 267 MB movies index).","schema_change":"Engine::VERSION 0.13.3 -> 0.13.4 so existing indexes rebuild on upgrade, which is how the new index reaches them.","watch":"filtered_ms rose 219.33 -> 246.04 (+12%). That workload still goes through Searcher with a plain OFFSET, so the new index may have shifted a query plan. Verify the search and filter benchmark groups next.","checks":"Unit + functional suites, PHPStan, and the 73-comparison direct-vs-Searcher differential harness."}}
